{
  "schemaVersion": "1.0.0",
  "labId": "LAB-00",
  "runId": "fixture-00",
  "generatedAt": "2026-08-31T10:00:00Z",
  "executionMode": "execute",
  "result": "pass",
  "ownershipVerified": true,
  "actions": [
    {
      "checkpointId": "LAB00-CP01",
      "targetId": ".state/fixture-00/artifact-1.json",
      "targetType": "local/state",
      "ownership": {
        "method": "local-path",
        "verified": true
      },
      "status": "deleted",
      "message": "Fixture target removed after ownership verification."
    },
    {
      "checkpointId": "LAB00-CP02",
      "targetId": ".state/fixture-00/artifact-2.json",
      "targetType": "local/state",
      "ownership": {
        "method": "local-path",
        "verified": true
      },
      "status": "deleted",
      "message": "Fixture target removed after ownership verification."
    },
    {
      "checkpointId": "LAB00-CP03",
      "targetId": ".state/fixture-00/artifact-3.json",
      "targetType": "local/state",
      "ownership": {
        "method": "local-path",
        "verified": true
      },
      "status": "deleted",
      "message": "Fixture target removed after ownership verification."
    },
    {
      "checkpointId": "LAB00-CP04",
      "targetId": ".state/fixture-00/artifact-4.json",
      "targetType": "local/state",
      "ownership": {
        "method": "local-path",
        "verified": true
      },
      "status": "deleted",
      "message": "Fixture target removed after ownership verification."
    },
    {
      "checkpointId": "LAB00-CP05",
      "targetId": ".state/fixture-00/artifact-5.json",
      "targetType": "local/state",
      "ownership": {
        "method": "local-path",
        "verified": true
      },
      "status": "deleted",
      "message": "Fixture target removed after ownership verification."
    }
  ],
  "residualChecks": [
    {
      "id": "cp01.residual",
      "command": "query fixture IDs for LAB00-CP01 after cleanup",
      "expected": "zero active objects",
      "actual": "active=0",
      "status": "pass"
    },
    {
      "id": "cp02.residual",
      "command": "query fixture IDs for LAB00-CP02 after cleanup",
      "expected": "zero active objects",
      "actual": "active=0",
      "status": "pass"
    },
    {
      "id": "cp03.residual",
      "command": "query fixture IDs for LAB00-CP03 after cleanup",
      "expected": "zero active objects",
      "actual": "active=0",
      "status": "pass"
    },
    {
      "id": "cp04.residual",
      "command": "query fixture IDs for LAB00-CP04 after cleanup",
      "expected": "zero active objects",
      "actual": "active=0",
      "status": "pass"
    },
    {
      "id": "cp05.residual",
      "command": "query fixture IDs for LAB00-CP05 after cleanup",
      "expected": "zero active objects",
      "actual": "active=0",
      "status": "pass"
    }
  ],
  "activeManagedObjects": [],
  "retainedItems": []
}
